profile_id,source_branch,source_commit,top_module,included_hierarchy,excluded_hierarchy,stream_width,memory_axi_width,clock_domains,reset_domains,memory_mode,macro_count_estimate,external_blackboxes,verification_target,dc_scope,pnr_scope,sta_scope,resume_relevance,maturity,blockers,classification
dma_rx512_sameclk_register_sanity,fix/async64-aw-planner-pipeline,eed14d7a0dd86ca64177951c0bfc7c3f1829dfa7,dma_axi_write_engine_512,writer plus minimal register source,ingress pool CQ TX control,512,512,one,one,register model,0,none,elaboration and writer regression,small logic OOC,not representative,internal reg-to-reg only,low,analyzed,thin sanity wrapper not frozen,ANALYSIS
dma_rx512_sameclk_sram,fix/async64-aw-planner-pipeline,eed14d7a0dd86ca64177951c0bfc7c3f1829dfa7,TBD thin RX memory subsystem top,fixed ingress plus shared pool plus source selector plus 512 writer,TX AXI-Lite UFC and unrelated CQ policy,512,512,aclk,aresetn plus local soft reset,single-clock SRAM,TBD after generated views,SRAM leaves,macro equivalence and RX regression,RX subsystem,first P&R,one-clock internal and boundary STA,high,analyzed,no wrappers or macro organization frozen,ANALYSIS
dma_rx512_async_sram,fix/async64-aw-planner-pipeline,eed14d7a0dd86ca64177951c0bfc7c3f1829dfa7,TBD thin async RX memory subsystem top,source stores plus CDC bridge plus async512 writer,TX and unrelated control hierarchy,512,512,aclk and mem_clk,source and memory resets with joint hard-reset contract,single-clock SRAM plus dual-clock FIFO leaf,TBD after generated views,SRAM and dual-clock FIFO leaves,CDC stress plus macro equivalence,dual-clock RX subsystem,canonical RX P&R,multi-clock setup hold and CDC constraints,very high,analyzed,dual-clock memory leaf and reset contract need closure,ANALYSIS
dma_full_rx512_async_sram,fix/async64-aw-planner-pipeline,eed14d7a0dd86ca64177951c0bfc7c3f1829dfa7,frame_dma_rx_top,full RX TX CQ AXI-Lite UFC descriptor and RX CDC,carrier adapter unless explicitly integrated,512,RX payload 512 and shared TX CQ 64,aclk and mem_clk with TX clock contract unresolved,aresetn mem_aresetn and soft-reset quiesce,mixed macro and register storage,TBD after generated views,SRAM leaves and optional carrier interfaces,full regression plus CDC and macro collision tests,full design,final system P&R,full internal plus IO timing,highest,planned,unused tx clock ports and mixed-width memory fabric,VERIFIED_REPOSITORY_FACT
dma_zynq_async64_compat,fix/async64-aw-planner-pipeline,eed14d7a0dd86ca64177951c0bfc7c3f1829dfa7,frame_dma_rx_top,full core with Async64 RX writer,ASIC native RX512 representative path,512,RX payload 64 and shared 64,aclk and mem_clk,aresetn mem_aresetn and soft-reset quiesce,generic or FPGA inferred memory,not an ASIC target,external DDR controller,compatibility regression and FPGA OOC,compatibility only,not canonical,compatibility STA only,low,verified branch-local development profile,not native ASIC PPA point,VERIFIED_REPOSITORY_FACT
